<?xml version="1.0"?>
<!-- Author: Ray Valdez, rvaldez@us.ibm.com -->
<!-- example xen policy file -->

<SecurityPolicySpec
xmlns="http://www.ibm.com"
xmlns:xsi="http://www.w3.org/2001/XMLSchema-instance"
xsi:schemaLocation="http://www.ibm.com SecurityPolicySpec.xsd">
<Policy>
 <PolicyHeader>
        <Name>xen sample policy</Name>
        <DateTime>2005-05-20T16:56:00</DateTime>
        <Tag>foobar</Tag>
        <TypeDefinition>
          <url>xen_sample_def.xml</url>
          <hash>abcdef123456abcdef</hash>
        </TypeDefinition>
 </PolicyHeader>

 <VM>
        <id> 0 </id>
        <TE>LOCAL-management</TE>
        <TE>R-Company-development</TE>
        <TE>S-Company-order</TE>
        <TE>T-Company-advertising</TE>
        <TE>U-Company-computing</TE>
		 <ChWall>Q-Company</ChWall>
 </VM>

 <VM>
        <id> 1 </id>
        <TE>R-Company-development</TE>
		 <ChWall>R-Company</ChWall>
 </VM>

 <VM>
        <id> 2 </id>
        <TE>S-Company-order</TE>
		 <ChWall>S-Company</ChWall>

 </VM>

 <VM>
        <id> 3 </id>
        <TE>T-Company-advertising</TE>
		 <ChWall>T-Company</ChWall>
 </VM>


 <VM>
        <id> 4 </id>
        <TE>U-Company-computing</TE>
		 <ChWall>U-Company</ChWall>
 </VM>


</Policy>
</SecurityPolicySpec>
