<?xml version="1.0"?>
<!-- Author: Ray Valdez, rvaldez@us.ibm.com -->
<!-- example policy type definition -->
<SecurityPolicySpec
xmlns="http://www.ibm.com"
xmlns:xsi="http://www.w3.org/2001/XMLSchema-instance"
xsi:schemaLocation="http://www.ibm.com SecurityPolicySpec.xsd">

<Definition>
<!-- an example of a simple type enforcement type definition -->
  <Types>
        <TE>LOCAL-management</TE>
        <TE>R-Company-development</TE>
        <TE>S-Company-order</TE>
        <TE>T-Company-advertising</TE>
        <TE>U-Company-computing</TE>
		 <!-- TE nondevelopment  -->
  </Types>

<!-- an example of a chinese wall type definition along with conflict sets-->
  <ChWallTypes>
		 <ChWall>Q-Company</ChWall>
		 <ChWall>R-Company</ChWall>
		 <ChWall>S-Company</ChWall>
		 <ChWall>T-Company</ChWall>
		 <ChWall>U-Company</ChWall>
		 <ChWall>V-Company</ChWall>
		 <ChWall>W-Company</ChWall>
		 <ChWall>X-Company</ChWall>
		 <ChWall>Y-Company</ChWall>
		 <ChWall>Z-Company</ChWall>
  </ChWallTypes>

  <ConflictSet>
		 <ChWall>T-Company</ChWall>
		 <ChWall>S-Company</ChWall>
   </ConflictSet>

   <ConflictSet>
		 <ChWall>R-Company</ChWall>
		 <ChWall>V-Company</ChWall>
		 <ChWall>W-Company</ChWall>
   </ConflictSet>

</Definition>
</SecurityPolicySpec>
